{"$defs":{"capability":{"additionalProperties":false,"properties":{"authority_denied":{"items":{"type":"string"},"minItems":1,"type":"array"},"can_actuate":{"type":"boolean"},"emits":{"items":{"type":"string"},"minItems":1,"type":"array"},"external_realizations":{"items":{"$ref":"#/$defs/externalRealization"},"type":"array"},"id":{"pattern":"^[a-z0-9][a-z0-9-]+$","type":"string"},"name":{"minLength":1,"type":"string"},"plane":{"pattern":"^P[0-8]_[A-Z_]+$","type":"string"},"purpose":{"minLength":1,"type":"string"},"repository_realizations":{"items":{"pattern":"^[^/]+/[^/]+$","type":"string"},"type":"array","uniqueItems":true},"standing":{"$ref":"#/$defs/standing"}},"required":["id","name","plane","purpose","authority_denied"],"type":"object"},"externalRealization":{"additionalProperties":false,"properties":{"identity_state":{"enum":["EXACT_SOURCE_UNOBSERVED","PARTIAL_OBSERVATION"]},"name":{"type":"string"}},"required":["name","identity_state"],"type":"object"},"relationship":{"additionalProperties":false,"properties":{"authority_transfer":{"type":"boolean"},"contract":{"minLength":1,"type":"string"},"id":{"pattern":"^r[0-9]{2}$","type":"string"},"relation":{"type":"string"},"source":{"type":"string"},"standing":{"$ref":"#/$defs/standing"},"target":{"type":"string"}},"required":["id","source","relation","target","contract"],"type":"object"},"repository":{"additionalProperties":false,"properties":{"capabilities_realized":{"items":{"type":"string"},"minItems":1,"type":"array","uniqueItems":true},"id":{"pattern":"^[^/]+/[^/]+$","type":"string"},"product_authority":{"type":"boolean"},"role":{"pattern":"^[A-Z0-9_]+$","type":"string"},"transport_lineage_only":{"type":"boolean"}},"required":["id","role","capabilities_realized"],"type":"object"},"standing":{"enum":["PARTIAL_ALIVE","ALIVE","BLOCKED","BUILD_BROKEN","UNKNOWN","UNSUPPORTED"]}},"$id":"https://chatmangpt.com/schemas/chatman-ecosystem-v1.schema.json","$schema":"https://json-schema.org/draft/2020-12/schema","additionalProperties":false,"properties":{"$schema":{"type":"string"},"authority":{"const":"AUTHORED_INPUT_ONLY"},"boundaries":{"items":{"additionalProperties":false,"properties":{"falsifier":{"type":"string"},"id":{"type":"string"},"name":{"type":"string"},"rule":{"type":"string"}},"required":["id","name","rule","falsifier"],"type":"object"},"minItems":7,"type":"array"},"capabilities":{"items":{"$ref":"#/$defs/capability"},"minItems":26,"type":"array"},"claim_classes":{"items":{"type":"string"},"minItems":10,"type":"array","uniqueItems":true},"corpus_base_sha":{"pattern":"^[0-9a-f]{40}$","type":"string"},"corpus_id":{"const":"chatman-ecosystem-architecture-corpus"},"corpus_repository":{"const":"seanchatmangpt/ggen-legacy"},"defaults":{"additionalProperties":false,"properties":{"capability":{"additionalProperties":false,"properties":{"evidence_model":{"type":"string"},"evidence_refs":{"items":{"type":"string"},"type":"array"},"lifecycle":{"type":"string"},"standing":{"$ref":"#/$defs/standing"},"can_actuate":{"const":false}},"required":["standing","can_actuate"],"type":"object"},"relationship":{"additionalProperties":false,"properties":{"direct_actuation":{"const":false},"receipt_required":{"const":true},"authority_transfer":{"const":false},"standing":{"$ref":"#/$defs/standing"}},"required":["authority_transfer","receipt_required","direct_actuation","standing"],"type":"object"},"repository":{"additionalProperties":false,"properties":{"authority_domain":{"const":true},"cohort":{"const":"2026-07-31-same-day-reconstitution"},"exact_source_authority":{"type":"string"},"standing":{"$ref":"#/$defs/standing"},"validation_authority":{"const":"REPOSITORY_OWNED"},"product_authority":{"const":true},"transport_lineage_only":{"const":false}},"required":["product_authority","transport_lineage_only","validation_authority","standing"],"type":"object"}},"required":["capability","repository","relationship"],"type":"object"},"direct_actuation":{"const":false},"final_admission_allowed":{"const":false},"governing_pipeline":{"const":["O","O*","K","C","P","A","G","X","E"],"type":"array"},"mission":{"minLength":1,"type":"string"},"planes":{"items":{"additionalProperties":false,"properties":{"id":{"pattern":"^P[0-8]_[A-Z_]+$","type":"string"},"name":{"minLength":1,"type":"string"}},"required":["id","name"],"type":"object"},"minItems":9,"type":"array"},"relationships":{"items":{"$ref":"#/$defs/relationship"},"minItems":20,"type":"array"},"repositories":{"items":{"$ref":"#/$defs/repository"},"minItems":19,"type":"array"},"schema_version":{"const":"chatman-ecosystem/v1"},"source_cohort":{"minLength":1,"type":"string"},"standing":{"$ref":"#/$defs/standing"},"standing_ledger":{"items":{"additionalProperties":false,"properties":{"basis":{"type":"string"},"claim":{"type":"string"},"evidence_refs":{"items":{"type":"string"},"type":"array"},"state":{"$ref":"#/$defs/standing"}},"required":["claim","state","basis","evidence_refs"],"type":"object"},"minItems":4,"type":"array"},"title":{"minLength":1,"type":"string"}},"required":["schema_version","corpus_id","authority","corpus_repository","corpus_base_sha","direct_actuation","final_admission_allowed","standing","defaults","planes","capabilities","repositories","relationships","boundaries","standing_ledger"],"title":"Chatman Ecosystem Architecture Corpus","type":"object"}
