{"$schema":"./schemas/ecosystem.schema.json","schema_version":"chatman-ecosystem/v1","corpus_id":"chatman-ecosystem-architecture-corpus","title":"The Chatman Ecosystem Architecture Corpus","authority":"AUTHORED_INPUT_ONLY","corpus_repository":"seanchatmangpt/ggen-legacy","corpus_base_sha":"cab1f69ded52bb3ece8b46ad6c38688b7cf198d6","source_cohort":"authority/ecosystem-reconstitution/2026-07-31.repositories.json","direct_actuation":false,"final_admission_allowed":false,"standing":"PARTIAL_ALIVE","governing_pipeline":["O","O*","K","C","P","A","G","X","E"],"defaults":{"capability":{"standing":"PARTIAL_ALIVE","can_actuate":false},"repository":{"product_authority":true,"transport_lineage_only":false,"validation_authority":"REPOSITORY_OWNED","standing":"UNKNOWN"},"relationship":{"authority_transfer":false,"receipt_required":true,"direct_actuation":false,"standing":"PARTIAL_ALIVE"}},"planes":[{"id":"P0_CONSTITUTION","name":"Constitution and Epistemology"},{"id":"P1_OBSERVATION","name":"Observation and Admission"},{"id":"P2_CANDIDATES","name":"Candidate Construction"},{"id":"P3_PLANNING","name":"Planning and Optimization"},{"id":"P4_MANUFACTURE","name":"Manufacture"},{"id":"P5_ACTUATION","name":"Execution and Actuation"},{"id":"P6_EVIDENCE","name":"Evidence and Assurance"},{"id":"P7_INTERFACES","name":"Developer and Agent Interfaces"},{"id":"P8_PRODUCTS","name":"Product Realizations"}],"capabilities":[{"id":"chatman-equation","name":"Chatman Equation","plane":"P0_CONSTITUTION","purpose":"Defines lawful manufacture as A = μ(O*) and requires receipt-bound consequence.","authority_denied":["direct execution authority","self-certification"],"repository_realizations":["seanchatmangpt/ggen-legacy","seanchatmangpt/agile-protocol-specification"]},{"id":"gall-standing","name":"Gall Standing Calculus","plane":"P0_CONSTITUTION","purpose":"Separates bounded operational standing from unsupported or unknown claims.","authority_denied":["automatic upward promotion"],"repository_realizations":["seanchatmangpt/ggen-legacy","seanchatmangpt/chicago-tdd-tools"]},{"id":"star-toml","name":"star-toml","plane":"P1_OBSERVATION","purpose":"Carries bounded admitted configuration and observation state.","authority_denied":["filesystem actuation"],"external_realizations":[{"identity_state":"EXACT_SOURCE_UNOBSERVED","name":"star-toml"}],"standing":"UNKNOWN"},{"id":"graphlaw","name":"Graphlaw","plane":"P1_OBSERVATION","purpose":"Admits semantic facts, derives lawful consequences, and preserves refusal boundaries.","authority_denied":["filesystem mutation","deployment authority"],"repository_realizations":["seanchatmangpt/open-ontologies","seanchatmangpt/unrdf"],"external_realizations":[{"identity_state":"EXACT_SOURCE_UNOBSERVED","name":"Graphlaw"}]},{"id":"ggen","name":"ggen","plane":"P4_MANUFACTURE","purpose":"Projects admitted semantic authority into deterministic artifact families and bounded intents.","authority_denied":["ambient execution authority"],"repository_realizations":["seanchatmangpt/ggen"]},{"id":"ggen-legacy","name":"ggen-legacy","plane":"P4_MANUFACTURE","purpose":"Preserves executable architecture corpus, generalized primitives, packs, lineage, equivalence, and replay.","authority_denied":["source-repository actuation"],"repository_realizations":["seanchatmangpt/ggen-legacy"]},{"id":"cmd","name":"Combinatorial Maximalism / CMD","plane":"P2_CANDIDATES","purpose":"Constructs maximal reversible lawful candidate lattices before irreversible selection.","authority_denied":["execution grant"],"repository_realizations":["seanchatmangpt/ggen","seanchatmangpt/chicago-tdd-tools","seanchatmangpt/dspygen"]},{"id":"mfw","name":"MFW","plane":"P3_PLANNING","purpose":"Manufactures dependency-closed workflow and transition plans.","authority_denied":["direct action execution"],"repository_realizations":["seanchatmangpt/mfw"]},{"id":"powl","name":"POWL","plane":"P3_PLANNING","purpose":"Represents partially ordered workflow geometry and executable process structure.","authority_denied":["ambient actuation"],"repository_realizations":["seanchatmangpt/mfw","seanchatmangpt/ferroplan","seanchatmangpt/ostar"]},{"id":"pddl-ppddl","name":"PDDL / PPDDL","plane":"P3_PLANNING","purpose":"Represents deterministic, probabilistic, numeric, and policy planning problems.","authority_denied":["execution authority"],"repository_realizations":["seanchatmangpt/ferroplan","seanchatmangpt/mfw"]},{"id":"ferroplan","name":"ferroplan","plane":"P3_PLANNING","purpose":"Executes bounded deterministic and probabilistic planning and emits receipted plans.","authority_denied":["broker bypass"],"repository_realizations":["seanchatmangpt/ferroplan"]},{"id":"bcinr","name":"BCINR","plane":"P3_PLANNING","purpose":"Optimizes bounded resource allocation and candidate choice.","authority_denied":["execution grant"],"external_realizations":[{"identity_state":"EXACT_SOURCE_UNOBSERVED","name":"BCINR"}],"standing":"UNKNOWN"},{"id":"cmca","name":"CMCA","plane":"P3_PLANNING","purpose":"Explores constrained multi-criteria architecture choices.","authority_denied":["deployment authority"],"external_realizations":[{"identity_state":"EXACT_SOURCE_UNOBSERVED","name":"CMCA"}],"standing":"UNKNOWN"},{"id":"brce","name":"BRCE","plane":"P5_ACTUATION","purpose":"Acts as the exclusive consequential broker: zero unreceipted actuation.","authority_denied":["unbounded authority","self-issued grants"],"repository_realizations":["seanchatmangpt/mfw","seanchatmangpt/stpnt"],"can_actuate":true},{"id":"wasm4pm","name":"wasm4pm","plane":"P6_EVIDENCE","purpose":"Observes process execution, mines behavior, exports OCEL-compatible evidence, and supports replay.","authority_denied":["retroactive authorization"],"repository_realizations":["seanchatmangpt/wasm4pm","seanchatmangpt/wasm4pm-compat"]},{"id":"mfact","name":"mfact","plane":"P6_EVIDENCE","purpose":"Certifies manufactured formal artifacts and proof obligations.","authority_denied":["runtime actuation"],"external_realizations":[{"identity_state":"EXACT_SOURCE_UNOBSERVED","name":"mfact"}],"standing":"UNKNOWN"},{"id":"procint","name":"procint","plane":"P6_EVIDENCE","purpose":"Provides formal process-intelligence assurance and theorem-backed boundaries.","authority_denied":["deployment correspondence claims without evidence"],"repository_realizations":["seanchatmangpt/ggen"],"external_realizations":[{"identity_state":"EXACT_SOURCE_UNOBSERVED","name":"procint"}],"standing":"UNKNOWN"},{"id":"lean-assurance","name":"Lean Assurance Rails","plane":"P6_EVIDENCE","purpose":"Kernel-checks formal theorems while keeping implementation correspondence separate.","authority_denied":["automatic deployed-binary standing"],"repository_realizations":["seanchatmangpt/ggen"],"external_realizations":[{"identity_state":"EXACT_SOURCE_UNOBSERVED","name":"Lean theorem corpus"}]},{"id":"cargo-cicd","name":"cargo-cicd","plane":"P6_EVIDENCE","purpose":"Governs release-law execution, packaging, supply-chain evidence, and promotion.","authority_denied":["release without admission"],"repository_realizations":["seanchatmangpt/ggen-legacy"],"external_realizations":[{"identity_state":"EXACT_SOURCE_UNOBSERVED","name":"cargo-cicd"}],"standing":"UNKNOWN"},{"id":"unibit","name":"Unibit / UniverseOS","plane":"P5_ACTUATION","purpose":"Provides a bounded constitutional execution substrate with denial polarity and causal receipts.","authority_denied":["semantic graph authority","unreceipted external action"],"external_realizations":[{"identity_state":"EXACT_SOURCE_UNOBSERVED","name":"seanchatmangpt/unibit"}],"standing":"UNKNOWN"},{"id":"ostar","name":"Ostar","plane":"P7_INTERFACES","purpose":"Composes ontology admission, agent planning, motion compilation, and bounded agent intents.","authority_denied":["ambient tool authority"],"repository_realizations":["seanchatmangpt/ostar"]},{"id":"lsp-max","name":"LSP Max","plane":"P7_INTERFACES","purpose":"Provides syntax storage, semantic memory, protocol verification, and editor-facing operations.","authority_denied":["source-of-truth replacement"],"repository_realizations":["seanchatmangpt/lsp-max"]},{"id":"receipt-replay","name":"Receipt and Replay","plane":"P6_EVIDENCE","purpose":"Binds source, authority, execution, artifact, verifier, and replay identity.","authority_denied":["predicted evidence","self-certification"],"repository_realizations":["seanchatmangpt/ggen","seanchatmangpt/ggen-legacy","seanchatmangpt/stpnt"]},{"id":"ocel-process-evidence","name":"OCEL Process Evidence","plane":"P6_EVIDENCE","purpose":"Models object-centric execution events and preserves process lineage.","authority_denied":["execution authorization"],"repository_realizations":["seanchatmangpt/wasm4pm","seanchatmangpt/stpnt"]},{"id":"verifier-ladder","name":"Independent Verifier Ladder","plane":"P6_EVIDENCE","purpose":"Executes positive, negative, adversarial, performance, and replay gates.","authority_denied":["producer self-certification"],"repository_realizations":["seanchatmangpt/chicago-tdd-tools","seanchatmangpt/ggen-legacy","seanchatmangpt/lsp-max"]},{"id":"interview-assist","name":"InterviewAssist","plane":"P8_PRODUCTS","purpose":"Demonstrates a cognition-driven accessible product vertical manufactured from ecosystem contracts.","authority_denied":["production standing without security and tenancy closure"],"external_realizations":[{"identity_state":"EXACT_SOURCE_UNOBSERVED","name":"InterviewAssist"}],"standing":"UNKNOWN"}],"repositories":[{"id":"seanchatmangpt/ggen","role":"REPOSITORY_MANUFACTURING_KERNEL","capabilities_realized":["cmd","ggen","lean-assurance","procint","receipt-replay"]},{"id":"seanchatmangpt/ggen-legacy","role":"ENTERPRISE_ARCHITECTURE_FOUNDRY_CORPUS","capabilities_realized":["cargo-cicd","chatman-equation","gall-standing","ggen-legacy","receipt-replay","verifier-ladder"]},{"id":"seanchatmangpt/wasm4pm","role":"PROCESS_EVIDENCE_AND_MINING_ENGINE","capabilities_realized":["ocel-process-evidence","wasm4pm"]},{"id":"seanchatmangpt/wasm4pm-compat","role":"STRU